{
  "contract_schema": "https://raw.githubusercontent.com/adaliontech/Zaibatsu/v1.3.0/schemas/factory-bundle-manifest.schema.json",
  "schema_version": "zaibatsu.factory-bundle-manifest.v1",
  "factory": {
    "id": "example-product",
    "class": "economic_factory"
  },
  "source": {
    "factory_definition_sha256": "b9e0f0e7dcfc850f835d5f56ca8596a4b45419a943777afc889c64f508457eac",
    "module_catalog_sha256": "16db832de54aaba7775461df7e8b4f4e1684deebe32be608806161aac1b2628d",
    "factory_plan_sha256": "64c5b94ebb155de22293c12d7c0eaa86c523b24627d8eea3d236725893f8c08f",
    "module_api_version": "zaibatsu.module.v1"
  },
  "files": [
    {
      "path": "factory/catalog.json",
      "sha256": "16db832de54aaba7775461df7e8b4f4e1684deebe32be608806161aac1b2628d",
      "size": 6417
    },
    {
      "path": "factory/definition.json",
      "sha256": "b9e0f0e7dcfc850f835d5f56ca8596a4b45419a943777afc889c64f508457eac",
      "size": 1706
    },
    {
      "path": "factory/plan.json",
      "sha256": "ff0643e332b4a8808f668ef1e2a53fc1654288965f924f48439ecdac72031474",
      "size": 6135
    },
    {
      "path": "modules/ansible-host-reproduction/module.json",
      "sha256": "905bf55cd2fe0973a89702e8752e8dfec174606d58da15e289d984ecf8385fe9",
      "size": 804
    },
    {
      "path": "modules/bounded-runtime-secrets/module.json",
      "sha256": "4c62e939782ef9b5990d81de413a809aadfdb58c0c28e2785abd0a57a06a4585",
      "size": 800
    },
    {
      "path": "modules/deterministic-verification/module.json",
      "sha256": "636525656d07dc89683a08ae3ffefabfd592909a61b729f4efc024dc1a43df31",
      "size": 845
    },
    {
      "path": "modules/git-source/module.json",
      "sha256": "977317056e3b4ae88471cd7aeddb1b514bd5c3310ca1d73c324599785c61e412",
      "size": 737
    },
    {
      "path": "modules/nix-worker-environment/module.json",
      "sha256": "a58729508be0cda87c2db3748ae487d76d9d90e3facfb78cbcaded5385731759",
      "size": 761
    },
    {
      "path": "modules/owner-gated-feedback/module.json",
      "sha256": "ecb44bb384ff295af9af5b3b121fc53302364d12b6112c7275af2d6169caff26",
      "size": 815
    },
    {
      "path": "modules/sops-age-static-secrets/module.json",
      "sha256": "23462ec661dfc00e330ce8e604157aba5e44b1401e17369ab43ec408e1ac251d",
      "size": 770
    },
    {
      "path": "modules/systemd-scheduler/module.json",
      "sha256": "ff549f0c47e82dcc0126907d1cb423dc8339c6e294f0a89f465142f3f5e5bdb3",
      "size": 746
    },
    {
      "path": "modules/typed-agent-execution/module.json",
      "sha256": "b2a0558758afa709b2e03b3fe8e025c520c5ad6b80e4db7826d7a9b2e802e8d6",
      "size": 828
    },
    {
      "path": "schemas/factory-bundle-manifest.schema.json",
      "sha256": "5eb51f5f7bbcc7806ed0b28906f22a6c994fdfdbfb3af0db711431651e564ab4",
      "size": 2504
    },
    {
      "path": "schemas/factory-definition.schema.json",
      "sha256": "f34cfd745da82c6db906e245844125fc0e6b6a26c136038ae8e6cacd93ed5144",
      "size": 4406
    },
    {
      "path": "schemas/factory-plan.schema.json",
      "sha256": "11576bb2f8bec6d554560ec9a2d3decdbea02edfe130cb66982b641a854f34b1",
      "size": 3182
    },
    {
      "path": "schemas/module-artifact.schema.json",
      "sha256": "2c04467de31db7bd68c710f4942239ba3d215dc2c9da7524e681fb60c0b0c0ef",
      "size": 1954
    },
    {
      "path": "schemas/module-catalog.schema.json",
      "sha256": "99086403632bfb2485811c355d47613b40226a9d5feb7ceb8dc26484de42940f",
      "size": 2037
    }
  ],
  "selected_modules": [
    {
      "position": 0,
      "slot": "source_versioning",
      "module": "git-source",
      "artifact_sha256": "977317056e3b4ae88471cd7aeddb1b514bd5c3310ca1d73c324599785c61e412"
    },
    {
      "position": 1,
      "slot": "static_secrets",
      "module": "sops-age-static-secrets",
      "artifact_sha256": "23462ec661dfc00e330ce8e604157aba5e44b1401e17369ab43ec408e1ac251d"
    },
    {
      "position": 2,
      "slot": "runtime_secrets",
      "module": "bounded-runtime-secrets",
      "artifact_sha256": "4c62e939782ef9b5990d81de413a809aadfdb58c0c28e2785abd0a57a06a4585"
    },
    {
      "position": 3,
      "slot": "host_reproduction",
      "module": "ansible-host-reproduction",
      "artifact_sha256": "905bf55cd2fe0973a89702e8752e8dfec174606d58da15e289d984ecf8385fe9"
    },
    {
      "position": 4,
      "slot": "worker_environment",
      "module": "nix-worker-environment",
      "artifact_sha256": "a58729508be0cda87c2db3748ae487d76d9d90e3facfb78cbcaded5385731759"
    },
    {
      "position": 5,
      "slot": "scheduling",
      "module": "systemd-scheduler",
      "artifact_sha256": "ff549f0c47e82dcc0126907d1cb423dc8339c6e294f0a89f465142f3f5e5bdb3"
    },
    {
      "position": 6,
      "slot": "execution",
      "module": "typed-agent-execution",
      "artifact_sha256": "b2a0558758afa709b2e03b3fe8e025c520c5ad6b80e4db7826d7a9b2e802e8d6"
    },
    {
      "position": 7,
      "slot": "verification",
      "module": "deterministic-verification",
      "artifact_sha256": "636525656d07dc89683a08ae3ffefabfd592909a61b729f4efc024dc1a43df31"
    },
    {
      "position": 8,
      "slot": "feedback",
      "module": "owner-gated-feedback",
      "artifact_sha256": "ecb44bb384ff295af9af5b3b121fc53302364d12b6112c7275af2d6169caff26"
    }
  ],
  "rebuild_claim": {
    "scope": "portable_control_bundle",
    "byte_reproducible": true,
    "contains_selected_module_contracts": true,
    "contains_contract_schemas": true,
    "contains_runtime_implementations": false,
    "deploys_infrastructure": false,
    "proves_runtime_recovery": false
  }
}
